{
  "$schema": "../../schema/custom-ui-config.schema.json",
  "brand": {
    "appName": "Roomba Route Creator",
    "windowTitle": "Roomba Route Creator - お掃除経路エディタ",
    "icon": "Bot",
    "about": {
      "title": "Roomba Route Creator v1.0",
      "description": "初心者向けお掃除ロボット経路設定ツール",
      "company": "Robotics Clean Solutions"
    }
  },
  "theme": {
    "cssVariables": {
      "--color-primary-base": "#10b981",
      "--color-primary-hover": "#059669"
    }
  },
  "layout": {
    "showWelcomeModal": false,
    "topMenu": {
      "hiddenItemIds": ["help_devtools", "file_export_maps"]
    },
    "toolPanel": {
      "visibleTools": ["select", "add_point", "add_rect_sweep"],
      "allowImport": false,
      "allowExport": true,
      "allowSettings": false
    },
    "leftPanel": {
      "defaultOpen": true,
      "defaultWidth": 340,
      "viewMode": "tabs",
      "tabs": [
        { "type": "workflow", "id": "workflow", "title": "お掃除手順ガイド" },
        { "type": "builtin", "id": "project", "title": "詳細地点一覧" }
      ]
    },
    "rightPanel": {
      "defaultOpen": true,
      "defaultWidth": 320,
      "viewMode": "tabs",
      "tabs": [
        { "type": "builtin", "id": "inspector", "title": "属性設定" },
        { "type": "builtin", "id": "layers", "title": "マップレイヤー" }
      ]
    }
  },
  "workflow": {
    "id": "roomba_cleaning_flow",
    "title": "お掃除ルート作成ワークフロー",
    "steps": [
      {
        "id": "step_project",
        "title": "1. プロジェクトの準備",
        "description": "新しいお掃除計画を作成するか、保存済みのプロジェクトを開きます。",
        "actionButtons": [
          {
            "label": "新規プロジェクト作成",
            "action": "reset_project",
            "variant": "secondary",
            "icon": "FilePlus",
            "description": "現在の内容を初期化して新規作成します"
          },
          {
            "label": "プロジェクトを開く",
            "action": "open_project_dialog",
            "variant": "primary",
            "icon": "FolderOpen",
            "description": "保存済みの .wptroj ファイルを読み込みます"
          }
        ],
        "buttonsLayout": "column"
      },
      {
        "id": "step_map",
        "title": "2. マップの読み込み",
        "description": "間取りマップ画像（PGM / PNG / YAML）を読み込んでキャンバスに表示します。",
        "actionButtons": [
          {
            "label": "マップファイルを開く",
            "action": "open_map_dialog",
            "variant": "primary",
            "icon": "Map",
            "description": "ROS マップまたは間取り画像を読み込みます"
          }
        ],
        "onEnter": { "actions": ["triggerFitToMaps"] }
      },
      {
        "id": "step_robot_params",
        "title": "3. ロボットパラメータ設定",
        "description": "お掃除ロボットの寸法や走行パラメータを設定します。",
        "controls": [
          {
            "type": "slider",
            "target": { "action": "setRobotFootprintRadius" },
            "label": "ロボット半径 (m)",
            "min": 0.1,
            "max": 0.5,
            "step": 0.01,
            "default": 0.18
          }
        ],
        "actionButtons": [
          {
            "label": "詳細ロボット設定を開く",
            "action": "open_settings_modal",
            "args": { "tab": "robot" },
            "variant": "secondary",
            "icon": "Settings",
            "description": "矩形形状や詳細オフセットを設定できます"
          }
        ],
        "onEnter": { "state": { "showFootprints": true } }
      },
      {
        "id": "step_environment",
        "title": "4. 環境設定",
        "description": "アノテーションのポイント配置、障害物のアノテーション矩形配置、ノイズ消去のレイヤー配置を設定します。",
        "actionButtons": [
          {
            "label": "障害物ポイント配置",
            "action": "set_annotation_tool",
            "args": { "tool": "point", "defaultColor": "#ef4444", "defaultName": "障害物" },
            "variant": "secondary",
            "icon": "MapPin",
            "description": "進入不可地点をポイントで配置"
          },
          {
            "label": "障害物矩形エリア配置",
            "action": "set_annotation_tool",
            "args": { "tool": "rect", "defaultColor": "#ef4444", "defaultName": "進入禁止エリア" },
            "variant": "secondary",
            "icon": "Square",
            "description": "進入禁止矩形エリアを配置"
          },
          {
            "label": "ノイズ消去レイヤー配置",
            "action": "start_map_edit",
            "args": { "subTool": "circle", "fillValue": 0, "brushSize": 15, "layerName": "ノイズ消去" },
            "variant": "secondary",
            "icon": "Eraser",
            "description": "マップ上のゴミや不要なピクセルを消去"
          }
        ],
        "buttonsLayout": "column"
      },
      {
        "id": "step_cleaning_area",
        "title": "5. 清掃エリアの指定",
        "description": "清掃範囲を矩形で囲み、清掃可能範囲の計算を実行します。",
        "actionButtons": [
          {
            "label": "清掃範囲矩形を配置",
            "action": "set_annotation_tool",
            "args": { "tool": "rect", "defaultColor": "#3b82f6", "defaultName": "清掃範囲" },
            "variant": "secondary",
            "icon": "SquareDashed",
            "description": "掃除を行う対象領域を矩形で囲みます"
          },
          {
            "label": "清掃可能範囲を計算 (カスタムレイヤー)",
            "action": "run_plugin",
            "args": { "pluginId": "drivable_area_layer_generator" },
            "variant": "primary",
            "icon": "Layers",
            "description": "障害物や壁を考慮した進入可能マップレイヤーを生成"
          }
        ],
        "buttonsLayout": "column"
      },
      {
        "id": "step_generate_path",
        "title": "6. 経路生成",
        "description": "指定した清掃範囲に対してジグザグ走査経路を自動生成します。",
        "pluginTarget": "rect_search_generator",
        "simplifiedParams": [
          {
            "paramKey": "num_lines",
            "label": "お掃除の細かさ (走査線数)",
            "type": "select",
            "options": [
              { "label": "標準 (5ライン)", "value": 5 },
              { "label": "念入り (10ライン)", "value": 10 },
              { "label": "高速 (3ライン)", "value": 3 }
            ]
          }
        ],
        "actionButtons": [
          {
            "label": "清掃経路を自動生成する",
            "action": "run_active_plugin",
            "variant": "primary",
            "icon": "Play",
            "description": "ストライプ走査のウェイポイント列を一括生成します"
          }
        ]
      },
      {
        "id": "step_save_export",
        "title": "7. 保存",
        "description": "作成した清掃計画をプロジェクトとして保存、またはロボット用形式で書き出します。",
        "actionButtons": [
          {
            "label": "プロジェクトを保存",
            "action": "save_project",
            "variant": "primary",
            "icon": "Save",
            "description": ".wptroj 形式で全データを保存します"
          },
          {
            "label": "ロボット用ファイル書き出し (Export)",
            "action": "open_export_modal",
            "variant": "secondary",
            "icon": "Download",
            "description": "YAML / JSON / ROS2 形式でエクスポート"
          },
          {
            "label": "マップ画像一括出力",
            "action": "open_export_maps_modal",
            "variant": "outline",
            "icon": "Image",
            "description": "編集済みマップを画像ファイルとして出力"
          }
        ],
        "buttonsLayout": "column"
      }
    ]
  }
}
